id,opis,oczekiwane,kategoria_modelu,wyjasnienie_modelu
1,"Pacjent zgłasza nagły, silny ból w klatce piersiowej promieniujący do lewej ręki, duszność, zimne poty i nudności.",PILNE,PILNE,Pacjent może mieć objawy zawału serca lub ostrą niewydolność oddechową.
2,"Nagłe osłabienie prawej strony ciała, opadanie kącika ust, problemy z mową, objawy pojawiły się godzinę temu.",PILNE,PILNE,"Obserwowane objawy mogą wskazywać na poważne schorzenie, takie jak zawał lub udar."
3,"Silny ból głowy o nagłym początku, najsilniejszy w życiu, sztywność karku i nudności.",PILNE,PILNE,Objawy sugerują możliwość udaru mózgu lub innego ciężkiego stanu medycznego.
4,"Pacjent po urazie głowy, chwilowa utrata przytomności, dezorientacja i wymioty.",PILNE,PILNE,"Stan pacjenta sugeruje ewentualną poważną uszkodzenie mózgu lub uraz głowy, który może być zagrażający jego życiu."
5,"Wysoka gorączka powyżej 39 stopni, dreszcze, przyspieszony oddech i spadek ciśnienia.",PILNE,PILNE,"Powyższy opis sugeruje możliwość infekcji wyższego zakaźnika, np. grypy lub innej groźniejszej choroby."
6,"Nagła duszność, świszczący oddech, obrzęk warg i języka po użądleniu owada.",PILNE,PILNE,"Objawy sugerują udar ostry uduśniaczowy spowodowany użądleniem owada, wymagają natychmiastowej pomocy lekarskiej."
7,"Silny ból brzucha z twardością powłok, nasilający się przy dotyku, gorączka.",PILNE,DO LEKARZA,Pacjent ma objawy sugerujące infekcję lub ostrą zapalenie wyrostka robaczkowego.
8,"Obfite krwawienie z przewodu pokarmowego, czarne stolce i osłabienie.",PILNE,PILNE,"Stan pacjenta może wskazywać na zakrzepicę krwi lub uszkodzenie śluzówki przewodu pokarmowego, co wymaga niezwłocznego podjęcia interwencyjnych kroków."
9,"Pacjent z cukrzycą, splątany, zimna skóra, drżenie rąk, bardzo niskie stężenie glukozy.",PILNE,DO LEKARZA,"Niska glukoza i drżenia mogą wskazywać na niedokładną kontrolę cukrzycy, ale stan pacjenta nie jest pilny."
10,"Nagły spadek widzenia w jednym oku, bez bólu, objawy od kilkunastu minut.",PILNE,PILNE,Zagrożenie dla wzroku - konieczna szybka konsultacja ze specjalistą
11,"Silny ból w klatce piersiowej nasilający się przy oddychaniu, kaszel z krwią.",PILNE,PILNE,"Objawy sugerują poważną chorobę płuca lub inny poważny problem zdrowotny, który wymaga niezwłocznej interwencji medycznej."
12,"Ostry ból brzucha po prawej stronie, gorączka, nudności, brak apetytu.",PILNE,DO LEKARZA,Pacjent doświadcza objawów ostrzejszego zatrucia pokarmowego lub mogą one być przełomem infekcji układu moczowo-płciowego.
13,"Nagłe kołatanie serca, zawroty głowy, uczucie omdlewania.",PILNE,PILNE,Ostrzeżenie: możliwe zagrożenie życia lub stan nagły. Pacjent powinien być natychmiast sprawdzony przez lekarza w miejscu pracy lub transportowany do najbliższej kardiologicznej placówki.
14,"Uraz komunikacyjny, ból kręgosłupa, drętwienie kończyn dolnych.",PILNE,DO LEKARZA,"Pacjent ma objawy związane z urazem oraz odczuwa ból i drętwienie, co może wskazywać na powikłania lub konieczność dalszego badania."
15,"Wysoka gorączka u dziecka, sztywność karku, nadwrażliwość na światło.",PILNE,DO LEKARZA,"Objawy mogą wskazywać na infekcję podniebienia lub gardła, która wymaga diagnostyki i odpowiedniej terapii."
16,"Nagła utrata przytomności u osoby starszej, brak kontaktu przez kilka minut.",PILNE,PILNE,Prawdopodobieństwo udaru lub innego poważnego schorzenia wymagającego natychmiastowej interwencji.
17,"Silna reakcja alergiczna po leku, pokrzywka, duszność, spadek ciśnienia.",PILNE,PILNE,Stan jest poważny i może mieć następstwa dla życia pacjenta. Należy zapewnić niezwłoczną opiekę medyczną.
18,"Ostry ból jądra, nagły początek, nudności.",PILNE,DO LEKARZA,"Ból jądra może być objawem różnych schorzeń, w tym ciężkiego zapalenia jajnika u kobiet lub zespołu Orchi-Alborga u mężczyzn. Należy skonsultować się lekarzem, aby wykluczyć poważniejsze przyczyny i zidentyfikować odpowiednie podejście."
19,Pacjent zgłasza silny ból w klatce piersiowej połączony z dusznością i kaszlem.,PILNE,DO LEKARZA,"Ból w klatce piersiowej, duszność i kaszel mogą być objawami powikłań choroby układu oddechowego lub innego poważnego schorzenia. Niezbędna jest wizyta u lekarza do oceny."
20,Nagłe pogorszenie stanu chorego onkologicznego z dusznością i bólem.,PILNE,PILNE,"Stan pacjenta pogarsza się nieoczekiwanie, co może sygnalizować powikłania onkologiczne wymagające natychmiastowej interwencji medycznej."
21,Drgawki u osoby dorosłej bez wcześniejszej padaczki.,PILNE,PILNE,"Stan nagły, który może być objawem poważnego schorzenia lub nawet udaru. Konieczne jest sprawdzenie czy nie ma innych symptomów powodujących drgawkę."
22,Nagły silny ból pleców z osłabieniem nóg i zaburzeniem czucia.,PILNE,DO LEKARZA,"Objawy sugerują możliwe ostry porażenie rdzenia kręgowego lub inne poważne schorzenie, które wymagają niezwłocznego badania i rozpoznania przez lekarza specjalistę."
23,"Ostra duszność nocna, pienista wydzielina z ust.",PILNE,DO LEKARZA,Pacjent doświadcza ostrej duszności i ma podejrzenie zapalenia gardła.
24,Zatrzymanie oddawania moczu z silnym bólem podbrzusza.,PILNE,DO LEKARZA,"Pacjent doświadcza poważnego problemu zdrowotnego, który wymaga rozpoznania i leczenia od specjalisty."
25,Ciężkie odwodnienie z zaburzeniami świadomości.,PILNE,PILNE,"Stan pacjenta może szybko zmienić się na gorsze, wymaga natychmiastowej pomocy medycznej."
26,"Gorączka około 38 stopni utrzymująca się od 3 dni, kaszel, osłabienie.",DO LEKARZA,DO LEKARZA,"Pacjent ma objawy mogące sugerować infekcję dróg oddechowych lub przeziębienie, ale wymaga wizyty lekarskiej z uwagi na trwającą gorączkę i osłabienie."
27,"Ból brzucha trwający kilka dni, okresowe nudności, brak poprawy.",DO LEKARZA,DO LEKARZA,"Objawy są przewlekłe i nie poprawiają się samoczynnie, co może wskazywać na bardziej poważną chorobę wymagającą diagnostyki i terapii."
28,"Ból ucha, pogorszenie słuchu, stan podgorączkowy.",DO LEKARZA,DO LEKARZA,"Pacjent ma objawy bólu ucha i pogarszającego się słuchu, co może wskazywać na infekcję w obrębie ucha środkowego lub zakażenie górnych dróg oddechowych. Stany te wymagają konsultacji lekarskiej dla prawidłowej diagnostyki i postępowania."
29,"Nawracające bóle głowy, nasilające się przy stresie.",DO LEKARZA,DO LEKARZA,"Pacjent doświadcza nawrotów bólu głowy związanych ze stresem, co może być sygnałem dla bardziej szczegółowej diagnostyki."
30,"Kaszel z odkrztuszaniem wydzieliny, gorączka, ból w klatce piersiowej przy kaszlu.",DO LEKARZA,DO LEKARZA,"Pacjent może mieć infekcję górnych dróg oddechowych lub zapalenie płuc, wymaga badania i ewentualnego leczenia."
31,"Ból w dolnej części pleców promieniujący do nogi, utrzymujący się od tygodnia.",DO LEKARZA,DO LEKARZA,Stan ten wymaga oceny i ewentualnego podjęcia kroków diagnostycznych w celu ustalenia przyczyny bólu.
32,"Częste oddawanie moczu, pieczenie, stan podgorączkowy.",DO LEKARZA,DO LEKARZA,"Pacjent doświadcza objawów sugerujących możliwe problemy z układem moczowo-płciowym, wymagające diagnozy i leczenia przez specjalistę."
33,"Nasilający się ból kolana, obrzęk, ograniczenie ruchu.",DO LEKARZA,DO LEKARZA,"Pacjent doświadcza silnych objawów sugerujących możliwe uszkodzenie stawu lub chrząstki, które wymagają konsultacji z lekarzem ortopedą."
34,"Ból gardła, powiększone migdałki, gorączka.",DO LEKARZA,DO LEKARZA,Wskazuje na zakażenie dróg oddechowych i wymaga wizyty u lekarza.
35,"Nawracające bóle brzucha po posiłkach, wzdęcia.",DO LEKARZA,DO LEKARZA,"Objawy te mogą być sygnałem poważniejszego problemu z przewodem pokarmowym i wymagają konsultacji lekarskiej, aby wykluczyć bardziej niebezpieczne przyczyny."
36,"Wysypka skórna utrzymująca się kilka dni, świąd.",DO LEKARZA,DO LEKARZA,"Pacjent wymaga wizyty u lekarza z powodu trwającej wysypki skórnej i świądu, które mogą być objawami infekcji lub innej choroby."
37,"Ból w klatce piersiowej o charakterze kłującym, nasilający się przy ruchu.",DO LEKARZA,PILNE,"Objawy mogą wskazywać na ostrą chorobę sercowo-naczyniową lub inną ciężką chorobę, wymagającą niezwłocznego zapewnienia pacjentowi profesjonalnej opieki."
38,"Zawroty głowy przy zmianie pozycji, bez utraty przytomności.",DO LEKARZA,DO LEKARZA,Powyższe objawy mogą być sygnałem wad serca lub niepokoju nerwowego i wymagają dalszej diagnozy.
39,"Ból zęba nasilający się w nocy, obrzęk dziąsła.",DO LEKARZA,DO LEKARZA,Pacjent potrzebuje skonsultowania z dentystą ze względu na możliwe stan infekcyjny w jamie ustnej.
40,"Przewlekły kaszel u palacza, stopniowe pogorszenie tolerancji wysiłku.",DO LEKARZA,DO LEKARZA,Wymaga wizyty ze względu na stopniowe pogarszanie się stanu zdrowia i możliwość podstawowych problemów z oddechowymi.
41,Ból brzucha i biegunka utrzymujące się ponad tydzień.,DO LEKARZA,DO LEKARZA,"Utrzymanie bólu brzucha i biegunki przez więcej niż tydzień jest sygnałem, że problem nie powinien zostać pozostawiony bez udziału lekarskiego. Lekarz będzie mógł przeprowadzić dalsze badania i ustalić przyczynę objawów."
42,"Uczucie ucisku w klatce piersiowej przy wysiłku, ustępujące w spoczynku.",DO LEKARZA,DO LEKARZA,"Objawy mogą być symptomem choroby układu sercowo-naczyniowego lub innego powikłania, wymagających rozpoznania i ewentualnego leczenia przez specjalistę."
43,"Ból barku ograniczający ruch, bez urazu.",DO LEKARZA,DO LEKARZA,"Objawy sugerujące możliwe choroby stawów lub mięśni, wymagające badania i diagnozy przez lekarza specjalistę."
44,"Nasilające się zmęczenie, bladość skóry, zawroty głowy.",DO LEKARZA,DO LEKARZA,"Pacjent doświadcza ogólnego złego samopoczucia, co może być oznaką powikłania jakiegoś bardziej podstawowego problemu medycznego. Konieczna jest wizyta u lekarza, aby ustalić jego przyczynę."
45,"Problemy ze snem, przewlekłe napięcie i bóle głowy.",DO LEKARZA,DO LEKARZA,"Pacjent doświadcza przewlekłych problemów zdrowotnych, które wymagają zbadania przez specjalistę."
46,Ból nadgarstka utrzymujący się od kilku dni.,DO LEKARZA,DO LEKARZA,"Pacjent ma powtarzające się bóle, które mogą być objawem poważniejszej przyczyny, takiej jak choroba stawu lub nerwu."
47,"Ból stopy przy chodzeniu, bez urazu.",DO LEKARZA,DO LEKARZA,"Oznaki zapalenia lub uszkodzenia struktury kostki, może być konieczna wizyta lekarza specjalisty."
48,Utrata masy ciała bez zmiany diety.,DO LEKARZA,DO LEKARZA,"Wstrząs utraty masy ciała wymaga skonsultowania z lekarzem, aby wykluczyć przyczyny podstawowe."
49,Nawracające infekcje górnych dróg oddechowych.,DO LEKARZA,DO LEKARZA,"Pacjent wymaga wizyty lekarza z powodu nawracających infekcji, co może być sygnałem dla podjęcia dodatkowych badań lub zmiany leczenia."
50,Długotrwała chrypka i uczucie drapania w gardle.,DO LEKARZA,DO OBSERWACJI,"Objawy są charakterystyczne dla przeziębienia, nie stanowią zagrożenia zdrowia."
51,"Lekki ból gardła i katar trwające od wczoraj, bez gorączki.",DO OBSERWACJI,DO LEKARZA,Wizyta u lekarza może być niezbędna do ustalenia przyczyny objawów i zastosowania odpowiedniego leczenia.
52,Okresowy ból głowy ustępujący po odpoczynku.,DO OBSERWACJI,DO LEKARZA,"Stan ten wymaga dodatkowych rozważnień z lekarzem, aby wykluczyć bardziej poważne przyczyny."
53,Ból mięśni po intensywnym wysiłku fizycznym.,DO OBSERWACJI,DO OBSERWACJI,Objawy te są powszechną konsekwencją intensywnego treningu i powinny ustąpić samoczynnie.
54,"Niewielka gorączka 37.5 stopnia, złe samopoczucie.",DO OBSERWACJI,DO LEKARZA,"Pacjent ma lekkie objawy infekcyjne, lepiej skonsultować się z lekarzem."
55,"Ból brzucha po obfitym posiłku, ustępujący samoistnie.",DO OBSERWACJI,DO OBSERWACJI,Objawy zgodne z przejściowym i niepoważnym zaburzeniem jelit. W większości przypadków ustępują samoistnie.
56,Zatkany nos i kichanie w okresie pylenia.,DO OBSERWACJI,DO OBSERWACJI,"Objawy związane z sezonowym zmianą pogody, nie wymagają interwencji medycznej."
57,Lekki ból kolana po długim spacerze.,DO OBSERWACJI,DO OBSERWACJI,"Ból jest lekki i pojawił się dopiero po długim wysiłku, co sugeruje mogącego powstać stan zapalny lub przeciążenie stawu."
58,Okresowe kołatanie serca w sytuacjach stresowych.,DO OBSERWACJI,DO OBSERWACJI,"Około 40% populacji doświadcza okresowego zwiększenia częstości uderzeń serca w czasie stresu lub emocji intensywnych, ale nie powinno ono stanowić żadnego poważniejszego problemu zdrowotnego."
59,Niewielkie zawroty głowy przy odwodnieniu.,DO OBSERWACJI,DO LEKARZA,"Zawroty głowy mogą być symptomem poważniejszego problemu, zwłaszcza w sytuacji odwodnienia."
60,Przemijający ból pleców po długim siedzeniu.,DO OBSERWACJI,DO LEKARZA,"Ból pleców może być objawem wielu różnych problemów, więc najlepiej sprawdzić u lekarza, aby wykluczyć poważniejsze przyczyny."
61,Lekka biegunka trwająca jeden dzień.,DO OBSERWACJI,DO OBSERWACJI,"Objawy są łagodne i przejściowe, nie ma potrzeby wizyty u lekarza."
62,Zmęczenie po kilku dniach intensywnej pracy.,DO OBSERWACJI,DO OBSERWACJI,Powyższe objawy są przewlekłe i nie powodują stanu zagrożenia życia.
63,Ból głowy związany z brakiem snu.,DO OBSERWACJI,DO OBSERWACJI,Objawy są spowodowane przez brak snu i powinny się poprawić po odpoczynku.
64,Lekki kaszel bez innych objawów.,DO OBSERWACJI,DO OBSERWACJI,"Objawy są łagodne i nie powinny wywołać obaw o zdrowie, dlatego można poczekać z wizytą u lekarza."
65,"Niewielkie bóle brzucha u dziecka, bez innych objawów.",DO OBSERWACJI,DO OBSERWACJI,Objawy są łagodne i nie istnieje ryzyko poważniejszego schorzenia. W razie pogorszenia się stanu należy skonsultować się z lekarzem.
66,Uczucie suchości w gardle.,DO OBSERWACJI,DO LEKARZA,"Wymaga wizyty lekarza, może być objawem infekcji czy innego schorzenia wymagającego diagnostyki."
67,Delikatna wysypka po nowym kosmetyku.,DO OBSERWACJI,RACZEJ BŁAHE,"Wysypka jest spowodowana przez nowy produkt kosmetyczny, powinno się ustąpić po krótkim czasie."
68,Ból karku po spaniu w niewygodnej pozycji.,DO OBSERWACJI,DO OBSERWACJI,"Ból karku po spaniu w niewygodnej pozycji jest częstym objawem, który zazwyczaj ustępuje samoczynnie."
69,Okresowe bóle głowy przy zmianie pogody.,DO OBSERWACJI,DO LEKARZA,"Ból głowy może być objawem wielu chorób, dlatego pacjent powinien skonsultować się z lekarzem w celu wykluczenia poważniejszych schorzeń."
70,Krótkotrwałe uczucie osłabienia po stresie.,DO OBSERWACJI,OBSERWACJA,"Stan nie powinien stanowić zagrożenia dla zdrowia, ale warto być świadomym własnego ciała i podejść do czynników stresowych."
71,Przejściowy ból brzucha po stresującej sytuacji.,DO OBSERWACJI,DO LEKARZA,"Pacjent wymaga wizyty, ale jest stabilny i nie ma objawów poważnych problemów zdrowotnych."
72,Lekki ból stawu po wysiłku.,DO OBSERWACJI,DO OBSERWACJI,"Objawy są łagodne i nie powinny powodować zaniepokojenia, ale mogą wymagać badania ze strony lekarza w przypadku trwających lub pogarszających się objawów."
73,Niewielkie drętwienie palców po zimnie.,DO OBSERWACJI,RACZEJ BŁAHE,"Mrowienie jest dolegliwością kosmetyczną i nie powinno powodować obawy, jeśli jest krótkotrwałe."
74,Uczucie ciężkości nóg po długim staniu.,DO OBSERWACJI,DO OBSERWACJI,"Oznaki niedokrwienia nerek lub otyłość; można poczekać i obserwować, ale warto poruszyć ten temat z lekarzem."
75,Przemijające nudności bez wymiotów.,DO OBSERWACJI,DO OBSERWACJI,"Objawy są łagodne i przejściowe, nie powinny stanowić zagrożenia dla zdrowia pacjenta."
76,Lekki katar bez innych objawów.,RACZEJ BŁAHE,OBSERWACJA,Objawy są łagodne i nie powinny stanowić zagrożenia dla zdrowia.
77,Ból mięśni po siłowni.,RACZEJ BŁAHE,DO LEKARZA,"Ponieważ ból mięśni jest powszechnym objawem po wysiłku fizycznym, w większości przypadków nie powinno on być przeszkodą do dalszej aktywności. Jednak jeśli ból utrzymuje się przez dłuższy czas lub jest bardzo silny, należy skonsultować się z lekarzem."
78,Zmęczenie po nieprzespanej nocy.,RACZEJ BŁAHE,DO OBSERWACJI,"Zmęczenie jest powszechnym doświadczeniem, szczególnie po braku snu. Może być spowodowane zmianą w nawykach lub okolicznościami."
79,Jednorazowy ból głowy ustępujący po nawodnieniu.,RACZEJ BŁAHE,DO LEKARZA,"Ból głowy może być objawem niepowikłanej migreny lub innego schorzenia, które wymaga zbadania."
80,Drobne skaleczenie palca.,RACZEJ BŁAHE,RACZEJ BŁAHE,"Objawy są łagodne i nie powinny powodować obaw, można poczekać aż dolegliwości miną."
81,Niewielkie zaczerwienienie skóry po słońcu.,RACZEJ BŁAHE,RACZEJ BŁAHE,Zaczerwienienie jest spowodowane przez narażenie na słońce i nie powinno powodować żadnych poważnych problemów zdrowotnych.
82,Krótkotrwały ból brzucha przed posiłkiem.,RACZEJ BŁAHE,DO LEKARZA,"Ból brzucha może być oznaką poważniejszych problemów, dlatego konieczna jest wizyta u lekarza, aby wykluczyć nieprawidłowości."
83,Chwilowe uczucie zimna bez gorączki.,RACZEJ BŁAHE,OBSERWACJA,Objawy są łagodne i nie powinny wywołać obaw o stan zdrowia.
84,Swędzenie skóry po ukąszeniu komara.,RACZEJ BŁAHE,RACZEJ_BŁAHE,Objawy są spowodowane przez ukąszenie owada i prawdopodobnie miną się same.
85,Ból głowy po długim czasie przed ekranem.,RACZEJ BŁAHE,DO LEKARZA,"Ból głowy może być symptomem przyczynę którego trzeba sprawdzić lekarz, może to być zmiana w pracy lub inne czynniki wywołujące zmiany w życiu codziennym."
86,Kichanie rano po przebudzeniu.,RACZEJ BŁAHE,DO OBSERWACJI,"Objawy są związane ze zmianą temperatury w ciągu nocy, nie powinny powodować obawy."
87,Uczucie pełności po obfitym posiłku.,RACZEJ BŁAHE,DO OBSERWACJI,"Zdarzenie towarzyszące normalnej fizjologii, nie wymaga interwencji medycznej."
88,Delikatny ból gardła po rozmowie na zimnie.,RACZEJ BŁAHE,DO OBSERWACJI,"Ból gardła jest przewlekły i można poczekać, aż ustanie."
89,Przemijające zawroty głowy po szybkim wstaniu.,RACZEJ BŁAHE,DO OBSERWACJI,"Zawroty głowy po wstaniu są dość powszechne, szczególnie u osób starszych lub przy braku równowagi w ciele."
90,Niewielki ból stawu po zmianie pogody.,RACZEJ BŁAHE,DO OBSERWACJI,"Objawy są łagodne i nie powinny być przeszkodą w normalnym funkcjonowaniu, o ile inne objawy nie pojawiają się."
91,Lekki ból brzucha po stresie.,RACZEJ BŁAHE,DO OBSERWACJI,"Objawy są łagodne i prawdopodobnie związane ze stresem, ale warto monitorować stan pacjenta."
92,Zmęczenie po długim dniu.,RACZEJ BŁAHE,OBSERWACJA,"Objawy nie są powodem do niepokoju, mogą ustąpić samoistnie."
93,Chwilowy dyskomfort w klatce piersiowej przy zdenerwowaniu.,RACZEJ BŁAHE,DO OBSERWACJI,"Oczekuje się, że objaw ustąpi samoczynnie i nie wymaga interwencji medycznej."
94,Ból karku po pracy przy komputerze.,RACZEJ BŁAHE,DO LEKARZA,"Powyższy opis sugeruje możliwość skurczowego zapalenia mięśni (zespół napięcia mięśniowego) spowodowanego długotrwałym siedzeniem przy komputerze, ale wymaga wizyty u lekarza do przeprowadzenia bardziej szczegółowej diagnostyki."
95,Jednorazowe uczucie nudności bez innych objawów.,RACZEJ BŁAHE,DO OBSERWACJI,"Nudności są częstym i zwykle lekkim odczuciem, które mogą minąć samodzielnie."
96,Lekki świąd skóry bez zmian widocznych.,RACZEJ BŁAHE,RACZEJ_BŁAHE,"Zapalenie skóry nie powoduje żadnych widocznych zmian, dlatego nie jest to sytuacja pilna."
97,Uczucie zimnych dłoni w chłodnym otoczeniu.,RACZEJ BŁAHE,DO OBSERWACJI,"Zdrowa osoba może doświadczać zjawiska Rayleigha, czyli zimna rąk w niskiej temperaturze."
98,Chwilowe mrowienie ręki po ucisku.,RACZEJ BŁAHE,RACZEJ_BŁAHE,"Dolegliwość kosmetyczna, przejściowa i nie powodująca bólu."
99,Niewielkie napięcie mięśni szyi.,RACZEJ BŁAHE,DO OBSERWACJI,"Objawy są łagodne i mogą wynikać z różnych przyczyn, np. nadmiernego stresu lub nieprawidłowej siedzenia."
100,Krótkotrwały ból ucha po zmianie ciśnienia.,RACZEJ BŁAHE,DO OBSERWACJI,"Ból ucha jest powszechnym objawem, który często występuje po zmianie ciśnienia i ustępuje samoczynnie. Nie powinno ono spowodować niepokoju."
